year,month,days,event
2023,05,"[5, 6, 7]",Formula 1 Miami Grand Prix (Formula 1)
2023,05,6,Monaco ePrix Round 9 (Formula E)
2023,05,"[8, 9, 10, 11, 12, 13, 14, 15, 16, 17, 18, 19, 20, 21]",Internazionali BNL d’Italia (tennis)
2023,05,"[9, 10]",UEFA Champions League Semifinals Leg 1 (football men)
2023,05,14,Grand Prix de France (motoGP)
2023,05,"[14, 15, 16, 17, 18, 19, 20, 21, 22, 23, 24, 25, 26]",UEFA Women’s Under-17 Championship (football women)
2023,05,"[15, 16, 17, 18, 19, 20, 21]",PGA Championship (golf men)
2023,05,"[16, 17]",UEFA Champions League Semifinals Leg 2 (football men)
2023,05,"[17, 18, 19, 20, 21, 22, 23, 24, 25, 26, 27, 28]",UEFA European Under-17 Championship (football men)
2023,05,19,Challenge Cup Final (rugby men)
2023,05,"[19, 20, 21]",Formula 1 Imola Grand Prix (Formula 1)
2023,05,20,Heineken Champions Cup Final (rugby men)
2023,05,20,Preakness Stakes (horse racing)
2023,05,"[20, 21, 22, 23, 24, 25, 26, 27]",Gonet Geneva Open (tennis men)
2023,05,"[20, 21, 22, 23, 24, 25, 26, 27]",Open Parc Auvergne-Rhône-Alpes Lyon (tennis men)
2023,05,"[20, 21, 22, 23, 24, 25, 26, 27, 28]",FIFA U-20 World Cup 2023 (football men)
2023,05,"[22, 23, 24, 25, 26, 27, 28]",Roland Garros (tennis)
2023,05,"[26, 27, 28]",Formula 1 Grand Prix de Monaco (Formula 1)
2023,05,28,Rabat Diamond League (athletics)
2023,05,[],FIBA 3×3 World Cup (3×3 basketball)
2023,05,31,2023 UEFA Europa League Final (football men)
2023,05,1,UEFA Women’s Champions League Semifinals (football women)
2023,05,"[1, 2, 3, 4, 5, 6, 7]",Mutua Madrid Open (tennis)
2023,06,"[1, 2, 3, 4, 5, 6, 7, 8, 9, 10, 11, 12, 13, 14, 15, 16, 17, 18]",Start NBA Finals 2023 (basketball)
2023,06,2,Rome/Florence Diamond League (athletics)
2023,06,"[2, 3, 4]",Formula 1 Aramco Gran Premio de España (Formula 1)
2023,06,3,2023 UEFA Women’s Champions League Final (football women)
2023,06,3,FA Cup Final (football men)
2023,06,"[3, 4]",Jakarta ePrix Round 10 & 11 (Formula E)
2023,06,7,2023 UEFA Europa Conference League Final (football men)
2023,06,"[8, 9, 10, 11, 12, 13, 14, 15, 16, 17, 18]",Stanley Cup Finals (ice hockey men)
2023,06,9,Paris Diamond League (athletics)
2023,06,"[10, 11, 12, 13, 14, 15, 16, 17, 18]",Libema Open (tennis)
2023,06,"[10, 11, 12, 13, 14, 15, 16, 17, 18]",Boss Open (tennis men)
2023,06,10,2023 UEFA Champions League Final (football men)
2023,06,11,Gran Premio D’Italia (motoGP)
2023,06,"[12, 13, 14, 15, 16, 17, 18, 19, 20]",Official or friendly matches (football men)
2023,06,"[13, 14, 15, 16, 17]",WSF Squash World Cup (squash)
2023,06,"[14, 15, 16, 17, 18]",UEFA Nations League Finals 2023 (football men)
2023,06,15,Oslo Diamond League (athletics)
2023,06,"[15, 16, 17, 18, 19, 20, 21, 22, 23, 24, 25]",FIBA Women’s EuroBasket 2023 (basketball women)
2023,06,"[16, 17, 18]",Formula 1 Grand Prix du Canada (Formula 1)
2023,06,"[16, 17, 18, 19, 20, 21, 22, 23, 24, 25, 26, 27, 28]",CONCACAF Gold Cup (football men)
2023,06,"[17, 18, 19, 20, 21, 22, 23, 24]",Special Olympics World Summer Games (multiple sports)
2023,06,"[17, 18, 19, 20, 21, 22, 23, 24, 25]",Terra Wortmann Open (tennis men)
2023,06,18,Motorrad Grand Prix Deutschland (motoGP)
2023,06,"[19, 20, 21, 22, 23, 24, 25]",Cinch Championships (tennis men)
2023,06,"[21, 22, 23, 24, 25, 26, 27, 28]",3rd European Games (multiple sports)
2023,06,"[21, 22, 23, 24, 25, 26, 27, 28]",UEFA Under-21 EURO 2023 (football men)
2023,06,22,NBA Draft 2023 (basketball)
2023,06,"[23, 24, 25]",Women’s Water Polo World Cup 2023 Final (water polo women)
2023,06,24,Portland ePrix Round 12 (Formula E)
2023,06,"[24, 25, 26, 27, 28]",Rothesay International Eastbourne (tennis)
2023,06,"[24, 25, 26, 27, 28]",Mallorca Championships (tennis men)
2023,06,25,TT Assen (motoGP)
2023,06,"[28, 29]",NHL draft (ice hockey men)
2023,06,[],Formula 1 Rolex Grosser Preis von Osterreich (Formula 1)
2023,06,30,Lausanne Diamond League (athletics)
2023,06,[],Men’s Water Polo World Cup 2023 Final (water polo men)
2023,06,"[1, 2]",UEFA European Under-17 Championship (football men)
2023,06,"[1, 2, 3, 4, 5, 6, 7, 8, 9, 10, 11]",FIFA U-20 World Cup 2023 (football men)
2023,06,"[1, 2, 3, 4, 5, 6, 7, 8, 9, 10, 11]",Roland Garros (tennis)
2023,06,"[1, 2, 3, 4]",FIBA 3×3 World Cup (3×3 basketball)
2023,07,2,Stockholm Diamond League (athletics)
2023,07,"[3, 4, 5, 6, 7, 8, 9, 10, 11, 12, 13, 14, 15, 16]",UEFA European Under-19 Championship (football men)
2023,07,"[3, 4, 5, 6, 7, 8, 9, 10, 11, 12, 13, 14, 15, 16]",Wimbledon (tennis)
2023,07,"[7, 8, 9]",Formula 1 Pirelli British Grand Prix (Formula 1)
2023,07,9,Grand Prix of Kazakhstan (motoGP)
2023,07,"[9, 10, 11]",MLB Draft 2023 (baseball)
2023,07,"[14, 15, 16, 17, 18, 19, 20, 21, 22, 23, 24, 25, 26, 27, 28, 29, 30]",FINA World Aquatics Championships (swimming)
2023,07,"[15, 16]",Rome ePrix Round 13 & 14 (Formula E)
2023,07,16,Silesia Diamond League (athletics)
2023,07,"[18, 19, 20, 21, 22, 23, 24, 25, 26, 27, 28, 29, 30]",UEFA Women’s Under-19 Championship (football women)
2023,07,"[20, 21, 22, 23, 24, 25, 26, 27, 28]",FIFA Women’s World Cup (football women)
2023,07,21,Monaco Diamond League (athletics)
2023,07,"[21, 22, 23]",Formula 1 Armco Magyar Nagydij Grand Prix (Formula 1)
2023,07,23,London Diamond League (athletics)
2023,07,"[23, 24, 25, 26, 27, 28, 29]",XVII Summer EYOF (multiple sports)
2023,07,[28],31st FISU World University Games (multiple sports)
2023,07,"[28, 29, 30]",Formula 1 Rolex Belgian Grand Prix (Formula 1)
2023,07,"[29, 30]",London ePrix Round 15 & 16 (Formula E)
2023,07,[],Citi DC Open (tennis)
2023,07,"[1, 2, 3, 4, 5, 6, 7, 8, 9, 10, 11, 12, 13, 14, 15, 16]",CONCACAF Gold Cup (football men)
2023,07,"[1, 2]",3rd European Games (multiple sports)
2023,07,"[1, 2, 3, 4, 5, 6, 7, 8]",UEFA Under-21 EURO 2023 (football men)
2023,07,[1],Rothesay International Eastbourne (tennis)
2023,07,[1],Mallorca Championships (tennis men)
2023,07,"[1, 2]",Formula 1 Rolex Grosser Preis von Osterreich (Formula 1)
2023,07,"[1, 2]",Men’s Water Polo World Cup 2023 Final (water polo men)
2023,08,"[3, 4, 5, 6, 7, 8, 9, 10, 11, 12, 13]",UCI Cycling World Championships (multiple cycling categories)
2023,08,"[4, 5, 6, 7, 8, 9, 10, 11, 12, 13]",National Bank Open Toronto (tennis men)
2023,08,"[4, 5, 6, 7, 8, 9, 10, 11, 12, 13]",National Bank Open Montreal (tennis women)
2023,08,6,British Grand Prix (motoGP)
2023,08,"[8, 9, 10, 11, 12, 13, 14, 15, 16, 17, 18, 19]",32nd FISU World University Games (multiple sports)
2023,08,"[9, 10, 11, 12, 13]",AIG Women’s Open (golf women)
2023,08,"[10, 11, 12, 13, 14, 15, 16, 17, 18, 19, 20]",Sailing World Championships (sailing)
2023,08,12,Start 2023/2024 Premier League Season (football men)
2023,08,"[19, 20, 21, 22, 23, 24, 25, 26, 27]",World Athletics Championships (athletics)
2023,08,20,Motorrad Grand Prix von Österreich (motoGP)
2023,08,"[23, 24, 25, 26, 27]",40th FIG Rhythmic Gymnastics World Championships (rhythmic gymnastics)
2023,08,"[25, 26, 27]",Formula 1 Dutch Grand Prix (Formula 1)
2023,08,"[25, 26, 27, 28]",FIBA Basketball World Cup (basketball men)
2023,08,31,Diamond League Zurich (athletics)
2023,08,"[1, 2, 3, 4, 5, 6, 7, 8, 9, 10, 11, 12, 13, 14, 15, 16, 17, 18, 19, 20]",FIFA Women’s World Cup (football women)
2023,08,"[1, 2, 3, 4, 5, 6, 7, 8]",31st FISU World University Games (multiple sports)
2023,08,"[1, 2, 3, 4, 5, 6]",Citi DC Open (tennis)
2023,09,"[1, 2, 3]",Formula 1 Gran Premio Heineken d’Italia (Formula 1)
2023,09,2,Shenzhen Diamond League (athletics)
2023,09,3,Gran Premi de Catalunya (motoGP)
2023,09,"[4, 5, 6, 7, 8, 9, 10, 11, 12]",Official or friendly matches (football men)
2023,09,"[7, 8, 9, 10, 11, 12, 13, 14, 15, 16, 17, 18, 19, 20, 21, 22, 23, 24, 25, 26, 27, 28]",Rugby World Cup 2023 (rugby men)
2023,09,8,Brussels Diamond League (athletics)
2023,09,10,Gran Premio di San Marino e della Riviera di Rimini (motoGP)
2023,09,"[12, 13, 14, 15, 16, 17]",Davis Cup Finals Group Stage (tennis men)
2023,09,"[15, 16, 17]",Formula 1 Singapore Airlines Singapore Grand Prix (Formula 1)
2023,09,"[16, 17]",Eugene Diamond League (athletics)
2023,09,"[18, 19, 20, 21, 22, 23, 24]",2023 Solheim Cup (golf women)
2023,09,"[19, 20]",UEFA Champions League Group Stage MD1 (football men)
2023,09,"[22, 23, 24]",Laver Cup (tennis men)
2023,09,"[22, 23, 24]",Formula 1 Japanese Grand Prix (Formula 1)
2023,09,"[23, 24, 25, 26, 27, 28]","Asian Games (multiple sports, incl. e-sports)"
2023,09,24,Grand Prix of India (motoGP)
2023,09,24,BMW Berlin Marathon (athletics)
2023,09,"[25, 26, 27, 28]",Ryder Cup (golf men)
2023,09,[],52nd FIG Artistic Gymnastics World Championships (artistic gymnastics)
2023,09,"[1, 2, 3, 4, 5, 6, 7, 8, 9, 10]",FIBA Basketball World Cup (basketball men)
2023,10,1,Grand Prix of Japan (motoGP)
2023,10,"[3, 4]",UEFA Champions League Group Stage MD2 (football men)
2023,10,"[5, 6, 7, 8, 9, 10, 11, 12, 13, 14, 15, 16, 17, 18, 19, 20, 21, 22, 23, 24, 25, 26, 27, 28]",ICC Men’s World Cup (cricket men)
2023,10,"[6, 7, 8]",Formula 1 Qatar Grand Prix (Formula 1)
2023,10,8,Chicago Marathon (athletics)
2023,10,"[9, 10, 11, 12, 13, 14, 15, 16, 17]",Official or friendly matches (football men)
2023,10,15,Grand Prix of Indonesia (motoGP)
2023,10,"[18, 19, 20, 21, 22]",European Championships in Aerobic Gymnastics (aerobic gymnastics)
2023,10,"[20, 21, 22]",Formula 1 United States Grand Prix (Formula 1)
2023,10,"[21, 22, 23, 24, 25, 26, 27, 28, 29]",Erste Bank Open (tennis men)
2023,10,"[21, 22, 23, 24, 25, 26, 27, 28, 29]",Swiss Indoors Basel (tennis men)
2023,10,22,Australian Motorcycle Grand Prix (motoGP)
2023,10,"[24, 25]",UEFA Champions League Group Stage MD3 (football men)
2023,10,"[24, 25, 26, 27, 28, 29]",WTA Elite Trophy (tennis women)
2023,10,"[27, 28, 29]",Formula 1 Mexican Grand Prix (Formula 1)
2023,10,[28],Rolex Paris Masters (tennis men)
2023,10,29,Thailand Grand Prix (motoGP)
2023,10,[],GNP Seguros WTA Finals (tennis women)
2023,10,"[1, 2, 3, 4, 5, 6, 7, 8, 9, 10, 11, 12, 13, 14, 15, 16, 17, 18, 19, 20, 21, 22, 23, 24, 25, 26, 27, 28]",Rugby World Cup 2023 (rugby men)
2023,10,"[1, 2, 3, 4, 5, 6, 7, 8]","Asian Games (multiple sports, incl. e-sports)"
2023,10,[1],Ryder Cup (golf men)
2023,10,"[1, 2, 3, 4, 5, 6, 7, 8]",52nd FIG Artistic Gymnastics World Championships (artistic gymnastics)
2023,11,"[3, 4, 5]",Formula 1 Grande Prêmio Heineken do Brasil (Formula 1)
2023,11,"[3, 4, 5]",ISU Four Continents Short Track Speed Skating Championships (short track skating)
2023,11,5,TCS New York City Marathon (athletics)
2023,11,"[7, 8]",UEFA Champions League Group Stage MD4 (football men)
2023,11,"[7, 8, 9, 10, 11, 12]",Billie Jean King Cup Finals (tennis women)
2023,11,"[9, 10, 11, 12]",37th FIG Trampoline Gymnastics World Championships (trampoline gymnastics)
2023,11,"[10, 11, 12, 13, 14, 15, 16, 17, 18, 19, 20, 21, 22, 23, 24, 25, 26, 27, 28]",FIFA U-17 World Cup 2023 (football men)
2023,11,12,Grand Prix of Malaysia (motoGP)
2023,11,"[12, 13, 14, 15, 16, 17, 18, 19]",Nitto ATP World Tour Finals (tennis men)
2023,11,"[13, 14, 15, 16, 17, 18, 19, 20, 21]",Official or friendly matches (football men)
2023,11,"[16, 17, 18]",Formula 1 Las Vegas Grand Prix (Formula 1)
2023,11,19,Grand Prix of Qatar (motoGP)
2023,11,"[21, 22, 23, 24, 25, 26]",Davis Cup Finals Knock-Out Stage (tennis men)
2023,11,"[24, 25, 26]",2023 Formula 1 Etihad Airways Abu Dhabi Grand Prix (Formula 1)
2023,11,26,Gran Premio de la Comunitat Valenciana (motoGP)
2023,11,"[28, 29]",UEFA Champions League Group Stage MD5 (football men)
2023,11,[28],Next Gen ATP Finals (tennis men)
2023,11,[],IHF Women’s World Championships (handball women)
2023,11,"[1, 2, 3, 4, 5, 6, 7, 8, 9, 10, 11, 12, 13, 14, 15, 16, 17, 18, 19]",ICC Men’s World Cup (cricket men)
2023,11,"[1, 2, 3, 4, 5]",Rolex Paris Masters (tennis men)
2023,11,"[1, 2, 3, 4, 5]",GNP Seguros WTA Finals (tennis women)
2023,12,"[28, 29, 30, 31]",United Cup (tennis)
2023,12,[31],Brisbane International (tennis)
2023,12,"[6, 7, 8, 9, 10]",Volleyball Men’s Club World Championship (club volleyball men)
2023,12,"[11, 12, 13, 14, 15, 16, 17]",WSF Men’s World Team Championships (squash)
2023,12,"[12, 13]",UEFA Champions League Group Stage MD6 (football men)
2023,12,"[12, 13, 14, 15, 16, 17, 18, 19, 20, 21, 22]",FIFA Club World Cup 2023 (football men)
2023,12,"[13, 14, 15, 16, 17]",Volleyball Women’s Club World Championship (club volleyball women)
2023,12,18,UEFA Champions League Round of 16 Draw (football men)
2023,12,"[28, 29, 30, 31]",United Cup (tennis)
2023,12,[31],Brisbane International (tennis)
2023,12,"[1, 2]",FIFA U-17 World Cup 2023 (football men)
2023,12,"[1, 2]",Next Gen ATP Finals (tennis men)
2023,12,"[1, 2, 3, 4, 5, 6, 7, 8, 9, 10, 11, 12, 13, 14, 15, 16, 17]",IHF Women’s World Championships (handball women)
2024,01,"[1, 2, 3, 4, 5, 6, 7]",United Cup (tennis)
2024,01,"[1, 2, 3, 4, 5, 6, 7]",Brisbane International (tennis)
2024,01,"[1, 2, 3, 4, 5, 6, 7, 8, 9, 10, 11, 12, 13]",ASB Classic (tennis)
2024,01,"[5, 6, 7]",ISU European Speed Skating Championships (speed skating)
2024,01,"[5, 6, 7, 8, 9, 10, 11, 12, 13, 14, 15, 16, 17, 18, 19]",2024 Dakar Rally (rally)
2024,01,"[8, 9, 10, 11, 12, 13]",Adelaide International (tennis)
2024,01,"[8, 9, 10, 11, 12, 13]",Hobart International (tennis women)
2024,01,"[8, 9, 10, 11, 12, 13, 14]",ISU European Figure Skating Championships (figure skating)
2024,01,"[10, 11, 12, 13, 14, 15, 16, 17, 18, 19, 20, 21, 22, 23, 24, 25, 26, 27, 28]",Men’s EHF EURO (handball men)
2024,01,"[12, 13, 14, 15, 16, 17, 18, 19, 20, 21, 22, 23, 24, 25, 26, 27, 28]",AFC Asian Cup (football men)
2024,01,"[12, 13, 14]",ISU European Short Track Speed Skating Championships (short track speed skating)
2024,01,13,Mexico City ePrix Round 1 (Formula E)
2024,01,"[13, 14, 15, 16, 17, 18, 19, 20, 21, 22, 23, 24, 25, 26, 27, 28]",2023 Africa Cup of Nations (football men)
2024,01,"[14, 15, 16, 17, 18, 19, 20, 21, 22, 23, 24, 25, 26, 27, 28]",Australian Open (tennis)
2024,01,"[19, 20, 21]",ISU Four Continents Speed Skating Championships (speed skating)
2024,01,"[19, 20, 21, 22, 23, 24, 25, 26, 27, 28]",Winter Youth Olympic Games (multiple winter sports)
2024,01,"[26, 27]",Diriyah ePrix Round 2 & 3 (Formula E)
2024,01,"[26, 27, 28]",X Games Aspen 2024 (extreme sports)
2024,01,27,Pegasus World Cup (horse racing)
2024,01,[],ISU Four Continents Figure Skating Championships (figure skating)
2024,01,"[1, 2, 3, 4, 5, 6, 7]",United Cup (tennis)
2024,01,"[1, 2, 3, 4, 5, 6, 7]",Brisbane International (tennis)
2024,02,"[2, 3, 4, 5, 6, 7, 8, 9, 10, 11, 12, 13, 14, 15, 16, 17, 18, 19, 20, 21, 22, 23, 24, 25, 26, 27, 28]",2024 Six Nations Championship (rugby)
2024,02,"[2, 3, 4, 5, 6, 7, 8, 9, 10, 11, 12, 13, 14, 15, 16, 17, 18]",FINA World Aquatics Championships (swimming)
2024,02,"[10, 11, 12, 13, 14, 15, 16, 17, 18]",ABN AMRO World Tennis Tournament (tennis men)
2024,02,11,Super Bowl LVIII (American football)
2024,02,"[13, 14, 20, 21]",UEFA Champions League Round of 16 Leg 1 (football men)
2024,02,"[15, 16, 17, 18]",ISU World Speed Skating Single Distances Championships (speed skating)
2024,02,"[15, 16, 17, 18, 19, 20, 21, 22, 23, 24, 25]",FIFA Beach Soccer World Cup 2024 (beach soccer)
2024,02,"[17, 18, 19, 20, 21, 22, 23, 24, 25]",Rio Open (tennis men)
2024,02,"[19, 20, 21, 22, 23, 24, 25]",Dubai Duty Free Tennis Championships (tennis women)
2024,02,25,EFL Carabao Cup Final (football men)
2024,02,"[26, 27, 28]",Abierto Mexicano (tennis men)
2024,02,"[26, 27, 28]",Dubai Duty Free Tennis Championships (tennis men)
2024,02,[],Formula 1 Gulf Air Bahrain Grand Prix (Formula 1)
2024,02,"[1, 2, 3, 4, 5, 6, 7, 8, 9, 10]",AFC Asian Cup (football men)
2024,02,"[1, 2, 3, 4, 5, 6, 7, 8, 9, 10, 11]",2023 Africa Cup of Nations (football men)
2024,02,[1],Winter Youth Olympic Games (multiple winter sports)
2024,02,"[1, 2, 3, 4]",ISU Four Continents Figure Skating Championships (figure skating)
2024,03,"[1, 2, 3]",World Athletics Indoor Championships (athletics)
2024,03,3,Tokyo Marathon (athletics)
2024,03,"[4, 5, 6, 7, 8, 9, 10, 11, 12, 13, 14, 15, 16, 17]",BNP Paribas Open Indian Wells (tennis)
2024,03,"[5, 6, 12, 13]",UEFA Champions League Round of 16 Leg 2 (football men)
2024,03,"[7, 8, 9]",Formula 1 Grand Prix Saudi Arabia (Formula 1)
2024,03,"[7, 8, 9, 10]",ISU World Speed Skating Allround & Sprint Championships (speed skating)
2024,03,10,Grand Prix of Qatar (motoGP)
2024,03,15,UEFA Champions League Quarterfinals & Semifinals Draw (football men)
2024,03,"[15, 16, 17]",ISU World Short Track Speed Skating Championships (short track speed skating)
2024,03,16,São Paulo ePrix Round 4 (Formula E)
2024,03,"[17, 18, 19, 20, 21, 22, 23, 24, 25, 26, 27, 28, 29, 30, 31]",Miami Open (tennis)
2024,03,"[18, 19, 20, 21, 22, 23, 24]",ISU World Figure Skating Championships (figure skating)
2024,03,"[18, 19, 20, 21, 22, 23, 24, 25, 26]",Official or friendly matches (football men)
2024,03,"[19, 20, 27, 28]",UEFA Women’s Champions League Quarterfinals (football women)
2024,03,"[22, 23, 24]",Formula 1 Australian Grand Prix (Formula 1)
2024,03,24,Grande Prémio de Portugal (motoGP)
2024,03,"[28, 29, 30, 31]",29th FIG Acrobatic Gymnastics World Championships (acrobatic gymnastics)
2024,03,30,Tokyo ePrix Round 5 (Formula E)
2024,03,"[1, 2, 3, 4, 5, 6, 7, 8, 9, 10, 11, 12, 13, 14, 15, 16]",2024 Six Nations Championship (rugby)
2024,03,"[1, 2]",Abierto Mexicano (tennis men)
2024,03,"[1, 2]",Dubai Duty Free Tennis Championships (tennis men)
2024,03,"[1, 2]",Formula 1 Gulf Air Bahrain Grand Prix (Formula 1)
2024,04,"[5, 6]",ISU World Synchronised Skating Championships (synchronised skating)
2024,04,"[5, 6, 7]",Formula 1 Japanese Grand Prix (Formula 1)
2024,04,"[6, 7, 8, 9, 10, 11, 12, 13, 14]",Rolex Monte-Carlo Masters (tennis men)
2024,04,7,Gran Premio de la República Argentina (motoGP)
2024,04,7,Schneider Electric Marathon de Paris (athletics)
2024,04,"[9, 10]",UEFA Champions League Quarterfinals Leg 1 (football men)
2024,04,"[11, 12, 13, 14]",Golf Masters Tournament Augusta (golf men)
2024,04,"[13, 14]",Misano ePrix Round 6 & 7 (Formula E)
2024,04,"[13, 14, 15, 16, 17, 18, 19, 20, 21]",Barcelona Open BancSabadell (tennis men)
2024,04,14,Marathon Rotterdam (athletics)
2024,04,14,Grand Prix of the Americas (motoGP)
2024,04,15,Boston Marathon (athletics)
2024,04,"[16, 17]",UEFA Champions League Quarterfinals Leg 2 (football men)
2024,04,"[19, 20, 21]",Formula 1 Grand Prix Shanghai (Formula 1)
2024,04,20,Xiamen Diamond League (athletics)
2024,04,"[20, 21, 27, 28]",UEFA Women’s Champions League Semifinals (football women)
2024,04,21,TCS London Marathon (athletics)
2024,04,21,World Athletics Race Walking Team Championships (athletics)
2024,04,"[22, 23, 24, 25, 26, 27, 28]",Mutua Madrid Open (tennis)
2024,04,"[24, 25, 26, 27, 28]",2024 Men’s Artistic Europeans (artistic gymnastics men)
2024,04,"[25, 26, 27]",NFL Draft 2024 (American football)
2024,04,27,Shanghai Diamond League (athletics)
2024,04,27,Monaco ePrix Round 8 (Formula E)
2024,04,28,Gran Premio de España (motoGP)
2024,04,[],UEFA Champions League Semifinals Leg 1 (football men)
2024,05,"[2, 3, 4, 5]",2024 Women’s Artistic Europeans (artistic gymnastics women)
2024,05,"[3, 4, 5]",Formula 1 Miami Grand Prix (Formula 1)
2024,05,"[4, 5]",World Athletics Relays (athletics)
2024,05,"[5, 6, 7, 8, 9, 10, 11, 12, 13, 14, 15, 16, 17, 18]",UEFA Women’s Under-17 Championship (football women)
2024,05,"[6, 7, 8, 9, 10, 11, 12, 13, 14, 15, 16, 17, 18, 19]",Internazionali BNL d’Italia (tennis)
2024,05,"[7, 8]",UEFA Champions League Semifinals Leg 2 (football men)
2024,05,10,Doha Diamond League (athletics)
2024,05,"[11, 12]",Berlin ePrix Round 9 & 10 (Formula E)
2024,05,12,Grand Prix de France (motoGP)
2024,05,"[13, 14, 15, 16, 17, 18, 19]",PGA Championship (golf men)
2024,05,"[17, 18, 19]",Formula 1 Imola Grand Prix (Formula 1)
2024,05,18,Preakness Stakes (horse racing)
2024,05,19,Rabat Diamond League (athletics)
2024,05,"[20, 21, 22, 23, 24, 25, 26, 27, 28]",UEFA European Under-17 Championship (football men)
2024,05,"[20, 21, 22, 23, 24, 25, 26, 27, 28]",Roland Garros (tennis)
2024,05,22,2024 UEFA Europa League Final (football men)
2024,05,"[22, 23, 24, 25, 26]",2024 Rhythmic Europeans (rhythmic gymnastics)
2024,05,24,Challenge Cup Final (rugby men)
2024,05,"[24, 25, 26]",Formula 1 Grand Prix de Monaco (Formula 1)
2024,05,25,Investec Champions Cup Final (rugby men)
2024,05,"[25, 26]",Shanghai ePrix Round 11 & 12 (Formula E)
2024,05,25,FA Cup Final (football men)
2024,05,25,2024 UEFA Women’s Champions League Final (football women)
2024,05,25,Eugene Diamond League (athletics)
2024,05,26,Gran Premi de Catalunya (motoGP)
2024,05,29,2024 UEFA Europa Conference League Final (football men)
2024,05,30,Oslo Diamond League (athletics)
2024,05,"[1, 2, 3, 4, 5]",Mutua Madrid Open (tennis)
2024,05,[1],UEFA Champions League Semifinals Leg 1 (football men)
2024,06,1,2024 UEFA Champions League Final (football men)
2024,06,"[1, 2, 3, 4, 5, 6, 7, 8, 9, 10, 11, 12, 13, 14, 15, 16, 17, 18, 19, 20, 21, 22, 23, 24, 25, 26, 27, 28, 29]",ICC Men’s T20 World Cup (cricket men)
2024,06,2,Stockholm Diamond League (athletics)
2024,06,2,Gran Premio D’Italia (motoGP)
2024,06,"[3, 4, 5, 6, 7, 8, 9, 10, 11]",Official or friendly matches (football men)
2024,06,"[6, 7, 8, 9, 10, 11, 12, 13, 14, 15, 16, 17, 18, 19, 20, 21, 22, 23]",Start NBA Finals 2024 (basketball)
2024,06,"[7, 8, 9]",Formula 1 Grand Prix du Canada (Formula 1)
2024,06,"[7, 8, 9, 10, 11, 12]",European Athletics Championships (athletics)
2024,06,"[13, 14, 15, 16]",US Open (golf men)
2024,06,"[14, 15, 16, 17, 18, 19, 20, 21, 22, 23, 24, 25, 26, 27, 28]",UEFA EURO 2024 (football men)
2024,06,"[15, 16, 17, 18, 19, 20, 21, 22, 23]",Cinch Championships (tennis men)
2024,06,"[15, 16, 17, 18, 19, 20, 21, 22, 23]",Terra Wortmann Open (tennis men)
2024,06,16,Grand Prix of Kazakhstan (motoGP)
2024,06,"[20, 21, 22, 23, 24, 25, 26, 27, 28]",CONMEBOL Copa America 2024 (football men)
2024,06,"[21, 22, 23]",Formula 1 Aramco Gran Premio de España (Formula 1)
2024,06,"[26, 27]",NBA Draft 2024 (basketball)
2024,06,"[28, 29, 30]",Formula 1 Rolex Grosser Preis von Osterreich (Formula 1)
2024,06,"[29, 30]",Portland ePrix Round 13 & 14 (Formula E)
2024,06,30,TT Assen (motoGP)
2024,06,"[1, 2, 3, 4, 5]",UEFA European Under-17 Championship (football men)
2024,06,"[1, 2, 3, 4, 5, 6, 7, 8, 9]",Roland Garros (tennis)
2024,07,"[1, 2, 3, 4, 5, 6, 7, 8, 9, 10, 11, 12, 13, 14]",Wimbledon (tennis)
2024,07,"[5, 6, 7]",Formula 1 Pirelli British Grand Prix (Formula 1)
2024,07,7,Motorrad Grand Prix Deutschland (motoGP)
2024,07,7,Paris Diamond League (athletics)
2024,07,12,Monaco Diamond League (athletics)
2024,07,"[14, 15, 16]",MLB Draft 2024 (baseball)
2024,07,"[14, 15, 16, 17, 18, 19, 20, 21, 22, 23, 24, 25, 26, 27]",UEFA Women’s Under-19 Championship (football women)
2024,07,"[15, 16, 17, 18, 19, 20, 21, 22, 23, 24, 25, 26, 27, 28]",UEFA European Under-19 Championship (football men)
2024,07,"[18, 19, 20, 21]",Then Open Championship (golf men)
2024,07,"[19, 20, 21]",Formula 1 Armco Magyar Nagydij Grand Prix (Formula 1)
2024,07,20,London Diamond League (athletics)
2024,07,"[20, 21]",London ePrix Round 15 & 16 (Formula E)
2024,07,"[20, 21, 22, 23, 24, 25, 26]",Hamburg European Open (tennis women)
2024,07,"[26, 27, 28]",Olympic Games (multiple sports)
2024,07,"[26, 27, 28]",Formula 1 Rolex Belgian Grand Prix (Formula 1)
2024,07,"[27, 28]",Mubadala Citi DC Open (tennis)
2024,07,"[1, 2, 3, 4, 5, 6, 7, 8, 9, 10, 11, 12, 13, 14]",UEFA EURO 2024 (football men)
2024,07,"[1, 2, 3, 4, 5, 6, 7, 8, 9, 10, 11, 12, 13, 14]",CONMEBOL Copa America 2024 (football men)
2024,07,"[1, 2, 3, 4, 5, 6, 7, 8, 9, 10, 11, 12, 13, 14]",Wimbledon (tennis)
2024,07,"[5, 6, 7]",Formula 1 Pirelli British Grand Prix (Formula 1)
2024,07,7,Motorrad Grand Prix Deutschland (motoGP)
2024,07,7,Paris Diamond League (athletics)
2024,07,12,Monaco Diamond League (athletics)
2024,07,"[14, 15, 16]",MLB Draft 2024 (baseball)
2024,07,"[14, 15, 16, 17, 18, 19, 20, 21, 22, 23, 24, 25, 26, 27]",UEFA Women’s Under-19 Championship (football women)
2024,07,"[15, 16, 17, 18, 19, 20, 21, 22, 23, 24, 25, 26, 27, 28]",UEFA European Under-19 Championship (football men)
2024,07,"[18, 19, 20, 21]",Then Open Championship (golf men)
2024,07,"[19, 20, 21]",Formula 1 Armco Magyar Nagydij Grand Prix (Formula 1)
2024,07,20,London Diamond League (athletics)
2024,07,"[20, 21]",London ePrix Round 15 & 16 (Formula E)
2024,07,"[20, 21, 22, 23, 24, 25, 26]",Hamburg European Open (tennis women)
2024,07,"[26, 27, 28]",Olympic Games (multiple sports)
2024,07,"[26, 27, 28]",Formula 1 Rolex Belgian Grand Prix (Formula 1)
2024,07,"[27, 28]",Mubadala Citi DC Open (tennis)
2024,08,"[1, 2, 3, 4, 5, 6, 7, 8, 9, 10, 11]",Olympic Games (multiple sports)
2024,08,"[1, 2, 3, 4]",Mubadala Citi DC Open (tennis)
2024,08,"[1, 2, 3, 4, 5, 6, 7, 8, 9, 10, 11]",Olympic Games (multiple sports)
2024,08,"[1, 2, 3, 4]",Mubadala Citi DC Open (tennis)
2024,08,"[3, 4, 5, 6, 7, 8, 9, 10, 11, 12]",National Bank Open Montreal (tennis men)
2024,08,4,British Grand Prix (motoGP)
2024,08,"[4, 5, 6, 7, 8, 9, 10, 11, 12]",National Bank Open Toronto (tennis women)
2024,08,"[11, 12, 13, 14, 15, 16, 17, 18, 19]",Western & Southern Open (tennis)
2024,08,17,Start 2024/2025 Premier League Season (football men)
2024,08,18,Motorrad Grand Prix von Österreich (motoGP)
2024,08,"[21, 22, 23, 24, 25]",AIG Women’s Open (golf women)
2024,08,22,Lausanne Diamond League (athletics)
2024,08,"[23, 24, 25]",Formula 1 Dutch Grand Prix (Formula 1)
2024,08,25,Silesia Diamond League (athletics)
2024,08,"[26, 27, 28]",US Open (tennis)
2024,08,[28],Paralympic Games (multiple sports)
2024,08,30,Rome Diamond League (athletics)
2024,08,[],Formula 1 Gran Premio Heineken d’Italia (Formula 1)
2024,08,[],FIFA U-20 Women’s World Cup 2024 (football women)
2024,09,"[1, 2, 3, 4, 5, 6, 7, 8]",US Open (tennis)
2024,09,"[1, 2, 3, 4, 5, 6, 7, 8]",Paralympic Games (multiple sports)
