year,month,days,event
2017,01,"[1, 2, 3, 4, 5, 6, 7]",Hopman Cup (tennis)
2017,01,"[1, 2, 3, 4, 5, 6, 7, 8]",Brisbane International presented by Suncorp (tennis)
2017,01,"[2, 3, 4, 5, 6, 7, 8, 9, 10, 11, 12, 13, 14]",2017 Dakar Rally (rally)
2017,01,"[6, 7, 8]",European Speed Skating Championships (speed skating)
2017,01,"[8, 9, 10, 11, 12, 13, 14]",Apia International Sydney (tennis)
2017,01,"[11, 12, 13, 14, 15, 16, 17, 18, 19, 20, 21, 22, 23, 24, 25, 26, 27, 28, 29]",2017 World Men’s Handball Championship (handball men)
2017,01,"[13, 14, 15]",European Short Track Speed Skating Championships (short track speed skating)
2017,01,"[13, 14, 15, 16, 17, 18, 19, 20, 21, 22]",Copa Centroamericana 2017 (football men)
2017,01,"[14, 15, 16, 17, 18, 19, 20, 21, 22, 23, 24, 25, 26, 27, 28]",Africa Cup of Nations 2017 (football men)
2017,01,"[16, 17, 18, 19, 20, 21, 22, 23, 24, 25, 26, 27, 28, 29]",Australian Open (tennis)
2017,01,"[17, 18, 19, 20, 21, 22, 23, 24, 25, 26, 27, 28]",2017 Central American Cup (football men)
2017,01,"[25, 26, 27, 28, 29]",European Figure Skating Championships (figure skating)
2017,01,[],28th Winter Universiade (multiple sports)
2017,01,[],St. Petersburg Ladies Trophy (tennis women)
2017,01,"[1, 2, 3, 4, 5, 6, 7, 8, 9, 10, 11, 12, 13, 14, 15, 16, 17, 18, 19, 20, 21, 22, 23, 24, 25, 26, 27, 28]",Diverse FIS Ski World Cup Alpine Skiing (alpine skiing)
2017,02,"[3, 4, 5]",Davis Cup 1st round (tennis men)
2017,02,"[4, 5, 6, 7, 8, 9, 10, 11, 12, 13, 14, 15, 16, 17, 18, 19, 20, 21, 22, 23, 24, 25, 26, 27, 28]",2017 Six Nations Championship (rugby)
2017,02,5,Super Bowl LI (American football)
2017,02,"[11, 12]",Fed Cup 1st round (tennis women)
2017,02,"[13, 14, 15, 16, 17, 18]",Qatar Total Open 2017 (tennis women)
2017,02,"[13, 14, 15, 16, 17, 18, 19]",ABN AMRO World Tennis Tournament (tennis men)
2017,02,"[14, 15, 21, 22]",Champions League Last 32 Leg 1 (football men)
2017,02,18,Buenos Aires ePrix Round 3 (Formula E)
2017,02,"[19, 20, 21, 22, 23, 24, 25]",Dubai Duty Free Tennis Championships (tennis women)
2017,02,"[19, 20, 21, 22, 23, 24, 25, 26]",8th Asian Winter Games (multiple sports)
2017,02,"[20, 21, 22, 23, 24, 25, 26]",Rio Open presented by Claro (tennis)
2017,02,26,EFL Cup Final (football men)
2017,02,"[26, 27, 28]",Dubai Duty Free Tennis Championships (tennis men)
2017,02,"[27, 28]",Abierto Mexicano Telcel (tennis)
2017,02,"[1, 2, 3, 4, 5, 6, 7, 8, 9, 10, 11, 12, 13, 14, 15, 16, 17, 18, 19, 20, 21, 22, 23, 24, 25, 26, 27, 28]",Diverse FIS Ski World Cup Alpine Skiing (Alpine skiing)
2017,02,"[1, 2, 3, 4, 5]",Africa Cup of Nations 2017 (football men)
2017,02,"[1, 2, 3, 4, 5, 6, 7, 8]",28th Winter Universiade (multiple sports)
2017,02,"[1, 2, 3, 4, 5]",St. Petersburg Ladies Trophy (tennis women)
2017,03,"[3, 4, 5]",European Athletics Indoor Championships (athletics)
2017,03,"[6, 7, 8, 9, 10, 11, 12, 13, 14, 15, 16, 17, 18, 19]",BNP Paribas Open – Indian Wells (tennis)
2017,03,"[7, 8, 14, 15]",Champions League Last 32 Leg 2 (football men)
2017,03,"[9, 10, 11, 12, 13, 14, 15, 16, 17, 18, 19, 20, 21, 22]",World Baseball Classic (baseball)
2017,03,"[14, 15, 16, 17, 18, 19, 20, 21, 22, 23, 24, 25]",Special Olympics World Winter Games (multiple sports)
2017,03,18,Milan – San Remo (cycling)
2017,03,"[20, 21, 22, 23, 24, 25, 26, 27, 28]",Official or friendly matches (football men)
2017,03,"[20, 21, 22, 23, 24, 25, 26, 27, 28]",Miami Open presented by Itaú (tennis)
2017,03,"[24, 25, 26]",Formula 1 Australian Grand Prix (Formula 1)
2017,03,26,Grand Prix of Qatar (motoGP)
2017,03,[],World Figure Skating Championships (figure skating)
2017,03,[],IIHF Ice Hockey Women’s World Championship (ice hockey women)
2017,03,"[1, 2, 3, 4, 5, 6, 7, 8, 9, 10, 11, 12, 13, 14, 15, 16, 17, 18, 19, 20, 21, 22, 23, 24, 25, 26, 27, 28]",Diverse FIS Ski World Cup Alpine Skiing (Alpine skiing)
2017,03,"[1, 2, 3, 4, 5, 6, 7, 8, 9, 10, 11, 12, 13, 14, 15, 16, 17, 18]",2017 Six Nations Championship (rugby)
2017,03,"[1, 2, 3, 4]",Dubai Duty Free Tennis Championships (tennis men)
2017,03,"[1, 2, 3, 4]",Abierto Mexicano Telcel (tennis)
2017,04,1,Mexico City ePrix Round 4 (Formula E)
2017,04,"[1, 2, 3, 4, 5, 6, 7, 8, 9]",Volvo Car Open (tennis women)
2017,04,"[6, 7, 8, 9]",Golf Masters Tournament Augusta (golf men)
2017,04,"[7, 8, 9]",Davis Cup Quarterfinals (tennis men)
2017,04,"[7, 8, 9]",Formula 1 UBS Chinese Grand Prix (Formula 1)
2017,04,8,Grand National 2017 (horse racing)
2017,04,9,Gran Premio de la República Argentina (motoGP)
2017,04,9,Marathon Rotterdam (athletics)
2017,04,9,Schneider Electric Marathon de Paris (athletics)
2017,04,9,Paris – Roubaix (cycling)
2017,04,"[11, 12]",Champions League Quarterfinals Leg 1 (football men)
2017,04,"[12, 13, 14, 15, 16]",2017 UCI Track Cycling World Championships (track cycling)
2017,04,"[14, 15, 16]",Formula 1 Gulf Air Bahrain Grand Prix (Formula 1)
2017,04,"[15, 16, 17, 18, 19, 20, 21, 22, 23]",Monte-Carlo Rolex Masters (tennis men)
2017,04,17,Boston Marathon (athletics)
2017,04,"[18, 19]",Champions League Quarterfinals Leg 2 (football men)
2017,04,"[19, 20, 21, 22, 23]",European Artistic Gymnastics Championships (artistic gymnastics)
2017,04,"[21, 22, 23, 24, 25, 26, 27, 28, 29, 30]",World Masters Games (multiple sports)
2017,04,"[22, 23]",Fed Cup Semifinals (tennis women)
2017,04,"[22, 23, 24, 25, 26, 27, 28, 29, 30]",Porsche Tennis Grand Prix (tennis women)
2017,04,23,Grand Prix of the Americas (motoGP)
2017,04,23,Liege – Bastogne – Liege (cycling)
2017,04,23,Virgin Money London Marathon (athletics)
2017,04,"[24, 25, 26, 27, 28, 29, 30]",Barcelona Open BancSabadell (tennis men)
2017,04,"[27, 28, 29]",NFL Draft 2017 (American football)
2017,04,"[27, 28]",FIFA Beach Soccer World Cup Bahamas 2017 (beach soccer)
2017,04,"[28, 29, 30]",2017 Formula 1 Russian Grand Prix (Formula 1)
2017,04,"[1, 2]",Miami Open presented by Itaú (tennis)
2017,04,"[1, 2]",World Figure Skating Championships (figure skating)
2017,04,"[1, 2, 3, 4, 5, 6, 7]",IIHF Ice Hockey Women’s World Championship (ice hockey women)
2017,05,"[2, 3]",Champions League Semifinals Leg 1 (football men)
2017,05,"[2, 3, 4, 5, 6, 7, 8, 9, 10, 11, 12, 13, 14]",UEFA Women’s Under-17 Championship (football women)
2017,05,"[3, 4, 5, 6, 7, 8, 9, 10, 11, 12, 13, 14, 15, 16, 17, 18, 19]",UEFA European Under-17 Championship (football men)
2017,05,5,Doha Diamond League (athletics)
2017,05,"[5, 6, 7, 8, 9, 10, 11, 12, 13, 14]",Mutua Madrid Open (tennis)
2017,05,"[5, 6, 7, 8, 9, 10, 11, 12, 13, 14, 15, 16, 17, 18, 19, 20, 21]",IIHF Ice Hockey World Championship (ice hockey men)
2017,05,"[5, 6, 7, 8, 9, 10, 11, 12, 13, 14, 15, 16, 17, 18, 19, 20, 21, 22, 23, 24, 25, 26, 27, 28]",Giro d’Italia (cycling)
2017,05,6,Kentucky Derby (horse racing)
2017,05,7,Gran Premio de España (motoGP)
2017,05,"[9, 10]",Champions League Semifinals Leg 2 (football men)
2017,05,"[10, 11, 12, 13, 14, 15, 16, 17, 18, 19, 20, 21]",Internazionali BNL d’Italia (tennis)
2017,05,"[12, 13, 14]",Formula 1 Gran Premio de España Pirelli (Formula 1)
2017,05,13,European Rugby Champions Cup Final (rugby men)
2017,05,13,Monaco ePrix Round 5 (Formula E)
2017,05,13,Shanghai Diamond League (athletics)
2017,05,"[19, 20, 21]",European Rhythmic Gymnastics Championships (rhythmic gymnastics)
2017,05,20,Paris ePrix Round 6 (Formula E)
2017,05,20,Preakness Stakes (horse racing)
2017,05,"[20, 21, 22, 23, 24, 25, 26, 27, 28]",FIFA Under-20 World Cup Korea Republic 2017 (football men)
2017,05,21,Grand Prix de France (motoGP)
2017,05,"[22, 23, 24, 25, 26, 27, 28]",Roland Garros (tennis)
2017,05,24,2017 UEFA Europa League Final (football men)
2017,05,"[25, 26, 27, 28]",Formula 1 Grand Prix de Monaco (Formula 1)
2017,05,"[26, 27]",Prefontaine Classic Diamond League (athletics)
2017,05,"[26, 27, 28]",2017 European Rowing Championships (rowing)
2017,05,"[26, 27, 28]",America’s Cup (sailing)
2017,05,27,FA Cup Final (football men)
2017,05,"[1, 2, 3, 4, 5, 6, 7]",FIFA Beach Soccer World Cup Bahamas 2017 (beach soccer)
2017,06,1,2017 UEFA Women Champions League Final (football women)
2017,06,1,Start NBA Finals 2017 (basketball)
2017,06,3,2017 UEFA Champions League Final (football men)
2017,06,4,Gran Premio D’Italia (motoGP)
2017,06,"[5, 6, 7, 8, 9, 10, 11, 12, 13]",Official or friendly matches (football men)
2017,06,8,Roma Diamond League (athletics)
2017,06,"[9, 10, 11]",Formula 1 Grand Prix du Canada (Formula 1)
2017,06,"[10, 11]",Berlin ePrix Round 7 & 8 (Formula E)
2017,06,11,Gran Premi de Catalunya (motoGP)
2017,06,"[12, 13, 14, 15, 16, 17, 18]",US Open (golf men)
2017,06,15,Oslo Diamond League (athletics)
2017,06,"[16, 17, 18, 19, 20, 21, 22, 23, 24, 25, 26, 27]",EuroBasket Women 2017 (basketball women)
2017,06,[],UEFA European Under-21 Championship (football men)
2017,06,"[17, 18, 19, 20, 21, 22, 23, 24, 25]",Gerry Weber Open (tennis men)
2017,06,"[17, 18, 19, 20, 21, 22, 23, 24, 25]",Aegon Birmingham Classic (tennis women)
2017,06,"[17, 18]",Le Mans 24 Hours (racing)
2017,06,"[17, 18, 19, 20, 21, 22, 23, 24, 25, 26, 27, 28]",FIFA Confederations Cup Russia 2017 (football men)
2017,06,18,Stockholm Diamond League (athletics)
2017,06,"[19, 20, 21, 22, 23, 24, 25]",Aegon Championships (tennis men)
2017,06,22,NBA Draft 2017 (basketball)
2017,06,"[23, 24, 25]",Formula 1 Baku European Grand Prix (Formula 1)
2017,06,"[23, 24, 25, 26, 27, 28]",Aegon Eastbourne International (tennis women)
2017,06,25,TT Assen (motoGP)
2017,06,"[26, 27, 28]",ICC Women’s World Cup (cricket women)
2017,06,"[1, 2, 3, 4, 5, 6, 7, 8, 9, 10, 11]",FIFA Under-20 World Cup Korea Republic 2017 (football men)
2017,06,"[1, 2, 3, 4, 5, 6, 7, 8, 9, 10, 11]",Roland Garros (tennis)
2017,06,"[1, 2, 3, 4, 5, 6, 7, 8, 9, 10, 11, 12, 13, 14, 15, 16, 17, 18, 19, 20, 21, 22, 23, 24, 25, 26, 27]",America’s Cup (sailing)
2017,07,1,Paris Saint-Denis Diamond League (athletics)
2017,07,"[1, 2, 3, 4, 5, 6, 7, 8, 9, 10, 11, 12, 13, 14, 15, 16, 17, 18, 19, 20, 21, 22, 23]",Le Tour de France (cycling)
2017,07,2,Motorrad Grand Prix Deutschland (motoGP)
2017,07,"[2, 3, 4, 5, 6, 7, 8, 9, 10, 11, 12, 13, 14, 15]",UEFA European Under-19 Championship (football)
2017,07,"[3, 4, 5, 6, 7, 8, 9, 10, 11, 12, 13, 14, 15, 16]",Wimbledon (tennis)
2017,07,6,Lausanne Diamond League (athletics)
2017,07,"[7, 8, 9]",2017 Formula 1 Austrian Grand Prix (Formula 1)
2017,07,"[7, 8, 9, 10, 11, 12, 13, 14, 15, 16, 17, 18, 19, 20, 21, 22, 23, 24, 25, 26]",CONCACAF Gold Cup 2017 (football men)
2017,07,9,Diamond League London (athletics)
2017,07,"[10, 11, 12, 13, 14, 15, 16]",US Women’s Open (golf women)
2017,07,"[14, 15, 16]",BMX European Championships (BMX racing)
2017,07,"[14, 15, 16]",2017 Formula 1 British Grand Prix (Formula 1)
2017,07,"[14, 15, 16, 17, 18, 19, 20, 21, 22, 23, 24, 25, 26, 27, 28, 29, 30]",17th FINA World Championships (swimming)
2017,07,"[15, 16]",New York City ePrix Round 9 & 10 (Formula E)
2017,07,16,Rabat Diamond League (athletics)
2017,07,"[16, 17, 18, 19, 20, 21, 22, 23]",146th Open Championship (golf men)
2017,07,"[16, 17, 18, 19, 20, 21, 22, 23, 24, 25, 26, 27, 28]",UEFA Women’s EURO Championship (football women)
2017,07,"[18, 19, 20, 21, 22, 23, 24, 25, 26, 27, 28, 29, 30]",2017 International Champions Cup (football men)
2017,07,"[20, 21, 22, 23, 24, 25, 26, 27, 28, 29, 30]",The World Games 2017 (multiple sports)
2017,07,21,Diamond League Monaco (athletics)
2017,07,"[22, 23, 24, 25, 26, 27, 28, 29, 30]",German Open (tennis men)
2017,07,"[28, 29, 30]",Formula 1 Magyar Nagydíj 2017 (Formula 1)
2017,07,"[29, 30]",Montreal ePrix Round 11 and 12 (Formula E)
2017,07,[],Citi Open (tennis)
2017,07,[],Bank of the West Classic (tennis women)
2017,07,"[1, 2]",FIFA Confederations Cup Russia 2017 (football men)
2017,07,[1],Aegon Eastbourne International (tennis women)
2017,07,"[1, 2, 3, 4, 5, 6, 7, 8, 9, 10, 11, 12, 13, 14, 15, 16, 17, 18, 19, 20, 21, 22, 23]",ICC Women’s World Cup (cricket women)
2017,08,"[3, 4, 5, 6]",Ricoh Women’s British Open (golf women)
2017,08,"[4, 5, 6, 7, 8, 9, 10, 11, 12, 13]",IAAF World Championships 2017 (athletics)
2017,08,"[4, 5, 6, 7, 8, 9, 10, 11, 12, 13]",Rogers Cup (tennis men)
2017,08,"[5, 6, 7, 8, 9, 10, 11, 12, 13]",Rogers Cup (tennis women)
2017,08,6,FA Community Shield (football men)
2017,08,6,Bwin Grand Prix Czech Republic (motoGP)
2017,08,"[7, 8, 9, 10, 11, 12, 13]",PGA Championship (golf men)
2017,08,8,UEFA Super Cup (football men)
2017,08,"[8, 9, 10, 11, 12, 13, 14, 15, 16, 17, 18, 19, 20]",UEFA European Women’s Under-19 Championship (football women)
2017,08,"[9, 10, 11, 12, 13, 14, 15, 16, 17, 18, 19, 20, 21, 22, 23, 24, 25, 26]",Women’s Rugby World Cup 2017 (rugby women)
2017,08,12,Start 2017-2018 Premier League Season (football men)
2017,08,"[12, 13, 14, 15, 16, 17, 18, 19, 20]",Western & Southern Open (tennis)
2017,08,13,Austrian Grand Prix (motoGP)
2017,08,"[14, 15, 16, 17, 18, 19, 20]",2017 Solheim Cup (golf women)
2017,08,"[18, 19, 20, 21, 22, 23, 24, 25, 26]",Connecticut Open (tennis women)
2017,08,"[18, 19, 20, 21, 22, 23, 24, 25, 26, 27]",Rabo EuroHockey Championships 2017 (hockey)
2017,08,"[19, 20, 21, 22, 23, 24, 25, 26, 27, 28, 29, 30]",29th Summer Universiade (multiple sports)
2017,08,"[19, 20, 21, 22, 23, 24, 25, 26, 27, 28]",La Vuelta (cycling)
2017,08,20,Birmingham Diamond League (athletics)
2017,08,24,Diamond League Zurich (athletics)
2017,08,24,UEFA Champions League Group Stage Draw (football men)
2017,08,"[25, 26, 27]",2017 Formula 1 Shell Belgian Grand Prix (Formula 1)
2017,08,27,British Grand Prix (motoGP)
2017,08,[28],2017 World Judo Championships (judo)
2017,08,[28],Official or friendly matches (football men)
2017,08,[28],US Open (tennis)
2017,08,[],EuroBasket 2017 (basketball men)
2017,08,"[1, 2, 3, 4, 5, 6]",UEFA Women’s EURO Championship (football women)
2017,08,"[1, 2, 3, 4, 5, 6]",Citi Open (tennis)
2017,08,"[1, 2, 3, 4, 5, 6]",Bank of the West Classic (tennis women)
2017,09,1,Brussels Diamond League (athletics)
2017,09,"[1, 2, 3]",Formula 1 Gran Premio d’Italia 2017 (Formula 1)
2017,09,7,Start 2017 NFL season (American football)
2017,09,10,Gran Premio TIM di San Marino e della Riviera di Rimini (motoGP)
2017,09,"[12, 13]",UEFA Champions League Group Stage MD1 (football men)
2017,09,"[13, 14, 15, 16, 17]",2017 European Table Tennis Championships (table tennis)
2017,09,"[15, 16, 17]",2017 Evian Championship (golf women)
2017,09,"[15, 16, 17]",2017 Formula 1 Singapore Airlines Singapore Grand Prix (Formula 1)
2017,09,"[15, 16, 17]",Davis Cup Semifinals (tennis men)
2017,09,"[16, 17, 18, 19, 20, 21, 22, 23, 24]",UCI Road World Championships (cycling)
2017,09,"[22, 23, 24]",Laver Cup (tennis men)
2017,09,"[23, 24, 25, 26, 27, 28, 29, 30]",Invictus Games (multiple sports)
2017,09,"[23, 24, 25, 26, 27, 28]",2017 World Rowing Championships (rowing)
2017,09,24,Gran Premio Movistar de Aragón (motoGP)
2017,09,24,BMW Berlin Marathon (athletics)
2017,09,"[24, 25, 26, 27, 28]",China Open (tennis)
2017,09,"[26, 27]",UEFA Champions League Group Stage MD2 (football men)
2017,09,"[26, 27, 28]",2017 Presidents Cup (golf men)
2017,09,[],Formula 1 Malaysia Grand Prix (Formula 1)
2017,09,"[1, 2, 3, 4, 5, 6, 7, 8, 9, 10]",La Vuelta (cycling)
2017,09,"[1, 2, 3]",2017 World Judo Championships (judo)
2017,09,"[1, 2, 3, 4, 5]",Official or friendly matches (football men)
2017,09,"[1, 2, 3, 4, 5, 6, 7, 8, 9, 10]",US Open (tennis)
2017,09,"[1, 2, 3, 4, 5, 6, 7, 8, 9, 10, 11, 12, 13, 14, 15, 16, 17]",EuroBasket 2017 (basketball men)
2017,10,"[2, 3, 4, 5, 6, 7, 8]",FIG Artistic Gymnastics World Championships (artistic gymnastics)
2017,10,"[2, 3, 4, 5, 6, 7, 8]",Rakuten Japan Open Tennis Championships (tennis men)
2017,10,"[2, 3, 4, 5, 6, 7, 8, 9, 10]",Official or friendly matches (football men)
2017,10,"[6, 7, 8]",2017 Formula 1 Japanese Grand Prix (Formula 1)
2017,10,"[6, 7, 8, 9, 10, 11, 12, 13, 14, 15, 16, 17, 18, 19, 20, 21, 22, 23, 24, 25, 26, 27, 28]",FIFA Under-17 World Cup India 2017 (football men)
2017,10,"[7, 8, 9, 10, 11, 12, 13, 14, 15]",Shanghai Rolex Masters (tennis men)
2017,10,8,Chicago marathon (athletics)
2017,10,"[14, 15, 16, 17, 18, 19, 20, 21, 22]",Kremlin Cup by Bank of Moscow (tennis)
2017,10,15,Motul Grand Prix of Japan (motoGP)
2017,10,"[17, 18]",UEFA Champions League Group Stage MD3 (football men)
2017,10,"[20, 21, 22]",2017 Formula 1 United States Grand Prix (Formula 1)
2017,10,"[21, 22, 23, 24, 25, 26, 27, 28, 29]",Swiss Indoors Basel (tennis men)
2017,10,22,Australian Grand Prix (motoGP)
2017,10,"[22, 23, 24, 25, 26, 27, 28, 29]",BNP Parisbas WTA Finals (tennis women)
2017,10,"[27, 28, 29]",2017 Formula 1 Mexican Grand Prix (Formula 1)
2017,10,[28],BNP Paribas Masters (tennis men)
2017,10,29,Shell Malaysia Motorcycle Grand Prix (motoGP)
2017,10,[],UEFA Champions League Group Stage MD4 (football men)
2017,10,[],WTA Elite Trophy (tennis women)
2017,10,[1],2017 World Rowing Championships (rowing)
2017,10,"[1, 2, 3, 4, 5, 6, 7, 8]",China Open (tennis)
2017,10,[1],2017 Presidents Cup (golf men)
2017,10,[1],Formula 1 Malaysia Grand Prix (Formula 1)
2017,11,"[3, 4]",Breeders’ Cup (Horse racing)
2017,11,5,TCS New York City Marathon (Athletics)
2017,11,"[6, 7, 8, 9, 10, 11, 12, 13, 14]",Official or friendly matches (football men)
2017,11,7,2017 Emirates Melbourne Cup (Horse racing)
2017,11,"[7, 8, 9, 10, 11]",Next Gen ATP Finals (tennis men)
2017,11,"[10, 11, 12]",Formula 1 Grande Prêmio Petrobras do Brasil 2017 (Formula 1)
2017,11,"[11, 12]",Fed Cup final (tennis women)
2017,11,12,Gran Premio de la Comunitat Valenciana (motoGP)
2017,11,"[12, 13, 14, 15, 16, 17, 18, 19]",Nitto ATP World Tour Finals (tennis men)
2017,11,"[21, 22]",UEFA Champions League Group Stage MD5 (football men)
2017,11,"[24, 25, 26]",2017 Formula 1 Etihad Airways Abu Dhabi Grand Prix (Formula 1)
2017,11,"[24, 25, 26]",Davis Cup Final (tennis men)
2017,11,"[1, 2, 3, 4, 5, 6, 7, 8, 9, 10, 11, 12, 13, 14, 15, 16, 17, 18, 19, 20, 21, 22, 23, 24, 25, 26, 27, 28]",Diverse FIS Ski World Cup Alpine Skiing (alpine skiing)
2017,11,"[1, 2, 3, 4, 5]",BNP Paribas Masters (tennis men)
2017,11,[1],UEFA Champions League Group Stage MD4 (football men)
2017,11,"[1, 2, 3, 4, 5]",WTA Elite Trophy (tennis women)
2017,12,"[30, 31]",Hopman Cup (tennis)
2017,12,[31],Brisbane International presented by Suncorp (tennis)
2017,12,1,Final Draw 2018 FIFA World Cup Russia (football men)
2017,12,"[1, 2, 3, 4, 5, 6, 7, 8, 9, 10, 11, 12, 13, 14, 15, 16, 17]",23rd IHF Women’s Handball World Championship (handball women)
2017,12,"[5, 6]",UEFA Champions League Group Stage MD6 (football men)
2017,12,"[6, 7, 8, 9, 10, 11, 12, 13, 14, 15, 16]",FIFA Club World Cup Japan 2017 (football men)
2017,12,"[11, 12, 13, 14, 15, 16, 17]",PSA World Championship 2017 (squash)
2017,12,"[30, 31]",Hopman Cup (tennis)
2017,12,[31],Brisbane International presented by Suncorp (tennis)
2017,12,"[1, 2, 3, 4, 5, 6, 7, 8, 9, 10, 11, 12, 13, 14, 15, 16, 17, 18, 19, 20, 21, 22, 23, 24, 25, 26, 27, 28]",Diverse FIS Ski World Cup Alpine Skiing (alpine skiing)
2018,01,[],St. Petersburg Ladies Trophy (tennis women)
2018,01,[],UEFA Futsal EURO 2018 (futsal men)
2018,01,"[1, 2, 3, 4, 5, 6]",Hopman Cup (tennis)
2018,01,"[1, 2, 3, 4, 5, 6, 7]",Brisbane International presented by Suncorp (tennis)
2018,01,"[5, 6, 7]",European Speed Skating Championships (speed skating)
2018,01,"[6, 7, 8, 9, 10, 11, 12, 13, 14, 15, 16, 17, 18, 19, 20]",2018 Dakar Rally (rally)
2018,01,"[7, 8, 9, 10, 11, 12, 13]",Apia International Sydney (tennis)
2018,01,"[12, 13, 14]",European Short Track Speed Skating Championships (short track speed skating)
2018,01,"[12, 13, 14, 15, 16, 17, 18, 19, 20, 21, 22, 23, 24, 25, 26, 27, 28]",2018 European Men’s Handball Championships (handball men)
2018,01,"[12, 13, 14, 15, 16, 17, 18, 19, 20, 21, 22, 23, 24, 25, 26, 27, 28]",2018 African Nations Championship (football men)
2018,01,13,Marrakesh ePrix Round 3 (Formula E)
2018,01,"[15, 16, 17, 18, 19, 20, 21]",ISU European Figure Skating Championships (figure skating)
2018,01,"[15, 16, 17, 18, 19, 20, 21, 22, 23, 24, 25, 26, 27, 28]",Australian Open (tennis)
2018,01,"[22, 23, 24, 25, 26, 27]",ISU Four Continents Figure Skating Championships (figure skating)
2018,01,"[25, 26, 27, 28]",X Games Aspen 2018 (extreme sports)
2018,01,27,Pegasus World Cup (horse racing)
2018,01,[],St. Petersburg Ladies Trophy (tennis women)
2018,01,[],UEFA Futsal EURO 2018 (futsal men)
2018,01,"[1, 2, 3, 4, 5, 6, 7, 8, 9, 10, 11, 12, 13, 14, 15, 16, 17, 18, 19, 20, 21, 22, 23, 24, 25, 26, 27, 28]",Diverse FIS Ski World Cup Alpine Skiing (alpine skiing)
2018,01,"[1, 2, 3, 4, 5, 6]",Hopman Cup (tennis)
2018,01,"[1, 2, 3, 4, 5, 6, 7]",Brisbane International presented by Suncorp (tennis)
2018,02,"[1, 2, 3, 4]",St. Petersburg Ladies Trophy (tennis women)
2018,02,"[1, 2, 3, 4, 5, 6, 7, 8, 9, 10]",UEFA Futsal EURO 2018 (futsal men)
2018,02,"[1, 2, 3, 4, 5, 6, 7, 8, 9, 10, 11]",AFC Futsal Championship 2018 (futsal men)
2018,02,"[2, 3, 4]",Davis Cup 1st round (tennis men)
2018,02,3,Santiago ePrix Round 4 (Formula E)
2018,02,"[3, 4, 5, 6, 7, 8, 9, 10, 11, 12, 13, 14, 15, 16, 17, 18, 19, 20, 21, 22, 23, 24, 25, 26, 27, 28]",2018 Six Nations Championship (rugby)
2018,02,4,Super Bowl LII (American football)
2018,02,"[9, 10, 11, 12, 13, 14, 15, 16, 17, 18, 19, 20, 21, 22, 23, 24, 25]",2018 Winter Olympics PyeongChang (multiple winter sports)
2018,02,"[10, 11]",Fed Cup 1st round (tennis women)
2018,02,"[12, 13, 14, 15, 16, 17]",Qatar Total Open 2018 (tennis women)
2018,02,"[12, 13, 14, 15, 16, 17, 18]",ABN AMRO World Tennis Tournament (tennis men)
2018,02,"[13, 14, 20, 21]",Champions League Last 32 Leg 1 (football men)
2018,02,"[19, 20, 21, 22, 23, 24, 25]",Dubai Duty Free Tennis Championships (tennis women)
2018,02,"[19, 20, 21, 22, 23, 24, 25]",Rio Open presented by Claro (tennis men)
2018,02,25,EFL Carabao Cup Final (football men)
2018,02,"[26, 27, 28]",Dubai Duty Free Tennis Championships (tennis men)
2018,02,"[26, 27, 28]",Abierto Mexicano Telcel (tennis)
2018,02,[28],2018 UCI Track Cycling World Championships (track cycling)
2018,02,"[1, 2, 3, 4, 5, 6, 7, 8, 9, 10, 11, 12, 13, 14, 15, 16, 17, 18, 19, 20, 21, 22, 23, 24, 25, 26, 27, 28]",Diverse FIS Ski World Cup Alpine Skiing (Alpine skiing)
2018,02,"[1, 2, 3, 4]",2018 African Nations Championship (football men)
2018,02,"[1, 2, 3, 4]",St. Petersburg Ladies Trophy (tennis women)
2018,02,"[1, 2, 3, 4, 5, 6, 7, 8, 9, 10]",UEFA Futsal EURO 2018 (futsal men)
2018,03,3,Mexico City ePrix Round 5 (Formula E)
2018,03,"[5, 6, 7, 8, 9, 10, 11, 12, 13, 14, 15, 16, 17, 18]",BNP Paribas Open – Indian Wells (tennis)
2018,03,"[6, 7, 13, 14]",Champions League Last 32 Leg 2 (football men)
2018,03,"[9, 10, 11]",ISU World Allround Speed Skating Championships (speed skating)
2018,03,"[9, 10, 11, 12, 13, 14, 15, 16, 17, 18]",2018 Winter Paralympics PyeongChang (multiple Paralympic winter sports)
2018,03,17,Milan – San Remo (cycling)
2018,03,17,Sao Paulo City ePrix Round 6 (Formula E)
2018,03,"[17, 18]",ISU World Short Track Speed Skating Championships (short track speed skating)
2018,03,18,Grand Prix of Qatar (motoGP)
2018,03,"[19, 20, 21, 22, 23, 24, 25]",ISU World Figure Skating Championships (figure skating)
2018,03,"[19, 20, 21, 22, 23, 24, 25, 26, 27]",Official or friendly matches (football men)
2018,03,"[19, 20, 21, 22, 23, 24, 25, 26, 27, 28]",Miami Open presented by Itaú (tennis)
2018,03,"[21, 22, 23, 24, 25]",World Figure Skating Championships (figure skating)
2018,03,"[23, 24, 25]",Formula 1 Australian Grand Prix (Formula 1)
2018,03,[],Volvo Car Open (tennis women)
2018,03,"[1, 2, 3, 4, 5, 6, 7, 8, 9, 10, 11, 12, 13, 14, 15, 16, 17, 18, 19, 20, 21, 22, 23, 24, 25, 26, 27, 28]",Diverse FIS Ski World Cup Alpine Skiing (Alpine skiing)
2018,03,"[1, 2, 3, 4, 5, 6, 7, 8, 9, 10, 11, 12, 13, 14, 15, 16, 17]",2018 Six Nations Championship (rugby)
2018,03,"[1, 2, 3]",Dubai Duty Free Tennis Championships (tennis men)
2018,03,"[1, 2, 3]",Abierto Mexicano Telcel (tennis)
2018,03,"[1, 2, 3, 4]",2018 UCI Track Cycling World Championships (track cycling)
2018,04,"[3, 4]",Champions League Quarterfinals Leg 1 (football men)
2018,04,"[4, 5, 6, 7, 8, 9, 10, 11, 12, 13, 14, 15]",Gold Coast 2018 Commonwealth Games (multiple sports)
2018,04,"[4, 5, 6, 7, 8, 9, 10, 11, 12, 13, 14, 15, 16, 17, 18, 19, 20, 21, 22]",Copa América Femenina 2018 (football women)
2018,04,"[5, 6, 7, 8]",Golf Masters Tournament Augusta (golf men)
2018,04,"[6, 7]",ISU World Synchronised Skating Championships (synchronised skating)
2018,04,"[6, 7, 8]",Davis Cup Quarterfinals (tennis men)
2018,04,"[6, 7, 8]",Formula 1 Gulf Air Bahrain Grand Prix (Formula 1)
2018,04,8,Gran Premio de la República Argentina (motoGP)
2018,04,8,Marathon Rotterdam (athletics)
2018,04,8,Schneider Electric Marathon de Paris (athletics)
2018,04,8,Paris – Roubaix (cycling)
2018,04,"[10, 11]",Champions League Quarterfinals Leg 2 (football men)
2018,04,"[12, 13, 14]",Grand National 2018 (horse racing)
2018,04,"[13, 14, 15]",Formula 1 UBS Chinese Grand Prix (Formula 1)
2018,04,14,Rome ePrix Round 7 (Formula E)
2018,04,14,Grand National (horse racing)
2018,04,"[14, 15, 16, 17, 18, 19, 20, 21, 22]",Monte-Carlo Rolex Masters (tennis men)
2018,04,16,Boston Marathon (athletics)
2018,04,20,Liege – Bastogne – Liege (cycling)
2018,04,"[21, 22]",Fed Cup Semifinals (tennis women)
2018,04,"[21, 22, 23, 24, 25, 26, 27, 28, 29]",Barcelona Open BancSabadell (tennis men)
2018,04,"[21, 22, 23, 24, 25, 26, 27, 28, 29]",Porsche Tennis Grand Prix (tennis women)
2018,04,22,Grand Prix of the Americas (motoGP)
2018,04,22,Virgin Money London Marathon (athletics)
2018,04,"[24, 25]",Champions League Semifinals Leg 1 (football men)
2018,04,"[26, 27, 28]",NFL Draft 2018 (American football)
2018,04,"[26, 27, 28, 29]",European Judo Championships (judo)
2018,04,"[27, 28, 29]",Formula 1 Baku Grand Prix (Formula 1)
2018,04,28,Paris ePrix Round 8 (Formula E)
2018,04,[1],Miami Open presented by Itaú (tennis)
